{
    "$schema": "../../../../environment/aws/topology_setup/topology_schema.json",
    "test_servers": [
		{
			"platform": "c_macos",
			"cbl_version": "{{version}}",
			"location": "localhost",
			"download": true
		}
	],
    "clusters": [
        {
            "server_count": 2
        },
        {
            "server_count": 1
        },
        {
            "server_count": 1
        }
    ],
    "sync_gateways": [
        {
            "cluster": 0
        },
        {
            "cluster": 0
        },
        {
            "cluster": 0
        },
        {
            "cluster": 1
        },
        {
            "cluster": 2
        }
    ],
    "load_balancers": [
        {
            "sync_gateways": [0, 1, 2]
        },
        {
            "sync_gateways": [3, 4]
        }
    ],
    "logslurp": true
}